text,true_label,lr_pred,bert_pred,case,lr_confusion_pair,bert_confusion_pair
Venezuela Prepares for Chavez Recall Vote Supporters and rivals warn of possible fraud; government says Chavez's defeat could produce turmoil in world oil market.,World,Business,Business,Both wrong,World -> Business,World -> Business
"Intel to delay product aimed for high-definition TVs SAN FRANCISCO -- In the latest of a series of product delays, Intel Corp. has postponed the launch of a video display chip it had previously planned to introduce by year end, putting off a showdown with Texas Instruments Inc. in the fast-growing market for high-definition television displays.",Business,Sci/Tech,Sci/Tech,Both wrong,Business -> Sci/Tech,Business -> Sci/Tech
Yahoo! Ups Ante for Small Businesses Web giant Yahoo! is gambling that price cuts on its domain name registration and Web hosting products will make it more competitive with discounters in the space -- which means that small businesses looking to move online get a sweeter deal through ...,Business,Sci/Tech,Sci/Tech,Both wrong,Business -> Sci/Tech,Business -> Sci/Tech
"IBM Buys Two Danish Services Firms IBM said Tuesday it has acquired a pair of Danish IT services firms as part of its effort to broaden its presence in Scandinavia. As a result of the moves, IBM will add about 3,700 IT staffers to its global head count. Financial terms of ...",Sci/Tech,Business,Business,Both wrong,Sci/Tech -> Business,Sci/Tech -> Business
"Oil prices bubble to record high The price of oil has continued its sharp rise overnight, closing at a record high. The main contract in New York, light sweet crude for delivery next month, has closed at a record \$US46.75 a barrel - up 70 cents on yesterday #39;s close. ",World,Business,Business,Both wrong,World -> Business,World -> Business
"Intuit Posts Wider Loss After Charge (Reuters) Reuters - Intuit Inc. (INTU.O), maker of\the No. 1 U.S. tax presentation software TurboTax, on Wednesday\posted a wider quarterly loss after taking a goodwill\impairment charge during its seasonally weaker fourth quarter.",Sci/Tech,Business,Business,Both wrong,Sci/Tech -> Business,Sci/Tech -> Business
"Hurricane center #39;s projection on Charley not far off, data show FORT LAUDERDALE, Fla. - (KRT) - Despite criticism that it should have better anticipated Hurricane Charley #39;s rapid intensification and quick turn, the National Hurricane Center #39;s forecast wasn #39;t that far off, a preliminary post-mortem shows. ",Sci/Tech,Business,Business,Both wrong,Sci/Tech -> Business,Sci/Tech -> Business
"Ciena Posts a Loss, Forecasts Flat Sales &lt;p&gt;&lt;/p&gt;&lt;p&gt; By Deborah Cohen&lt;/p&gt;&lt;p&gt; CHICAGO (Reuters) - Telecommunications equipment makerCiena Corp. &lt;CIEN.O&gt; on Thursday reported a wider loss for thefiscal third quarter due to slack demand and forecast sales inthe current quarter would be little changed from the thirdquarter.&lt;/p&gt;",Sci/Tech,Business,World,Both wrong,Sci/Tech -> Business,Sci/Tech -> World
Amazon Snaps Up China's Largest Web Retailer (NewsFactor) NewsFactor - Amazon.com (Nasdaq: AMZN) has said it will buy Joyo.com Limited -- a British Virgin Islands company that operates the largest Internet retail Web site in China -- for US #36;75 million.,Business,Sci/Tech,Sci/Tech,Both wrong,Business -> Sci/Tech,Business -> Sci/Tech
"Italian PM #39;s transplant confirmed After days of speculation sparked by the white bandanna worn by Mr Berlusconi on holiday in Sardinia, Piero Rosati said the results of the operation would show in a couple of months.",World,Business,Sports,Both wrong,World -> Business,World -> Sports
"Glory Comes Amid Empty Seats and Closed Shutters HERE in Old Europe, people install shutters outside their windows to keep out the heat, the pollution, the daylight, the noise. They also lock the shutters tight when they go away on holiday.",Sports,Sci/Tech,World,Both wrong,Sports -> Sci/Tech,Sports -> World
"Salesforce.com 2Q Profit Up Sharply Software developer Salesforce.com Inc. posted a sharp rise in second-quarter profit on better-than-expected revenue during its first quarter as a public company, but investors shunned the stock in late trading ",Sci/Tech,Business,Business,Both wrong,Sci/Tech -> Business,Sci/Tech -> Business
"Unknown Nesterenko Makes World Headlines (Reuters) Reuters - Belarus' Yuliya Nesterenko won the top\women's athletics gold medal at the Olympics on Saturday,\triumphing over a field stripped of many big names because of\doping woes to win the 100 meters.",World,Sports,Sports,Both wrong,World -> Sports,World -> Sports
Greek weightlifter awaits verdict Greek weightlifter Leonidas Sampanis will find out on Sunday if he is to be stripped of his medal.,World,Sports,Sports,Both wrong,World -> Sports,World -> Sports
"Nortel Downsizes Again Aug. 23, 2004 (TheDeal.com) Problem-plagued Nortel Networks Corp. announced plans Thursday, Aug. 19, to eliminate an additional 3,500 jobs and fire seven more senior executives as the company labors to reinvent ",Business,Sci/Tech,Sci/Tech,Both wrong,Business -> Sci/Tech,Business -> Sci/Tech
Chavez rejects CD as opposition Venezuela #39;s President Hugo Chavez has announced that he will no longer recognize the Democratic Coordination or CD as the opposition coalition.,Business,World,World,Both wrong,Business -> World,Business -> World
"Oil Eases as Iraq Resumes Exports &lt;p&gt;\&lt;/p&gt;&lt;p&gt; By Andrew Mitchell&lt;/p&gt;&lt;p&gt; LONDON (Reuters) - High-flying oil prices eased for a\second session on Monday as Iraq resumed exports from both its\northern and southern outlets after lengthy disruption, despite\fierce fighting in the holy city of Najaf.&lt;/p&gt;",Business,World,World,Both wrong,Business -> World,Business -> World
Deal has S2io champing at the gigabit OTTAWA -- A local firm that says it can help shrink backup times at large data centres is growing its business thanks to an alliance with Sun Microsystems Inc.,Business,Sci/Tech,Sci/Tech,Both wrong,Business -> Sci/Tech,Business -> Sci/Tech
Iran shuts reformist websites WEBSITES CLOSE to Iran #39;s leading reformist party have been blocked by religious hardliners in the police bureau of public morals.,Sci/Tech,World,World,Both wrong,Sci/Tech -> World,Sci/Tech -> World
" #39;Somebody please save my dad #39; Nick du Toit #39;s wife and stepdaughter are distraught that there is nothing they can do to help him. On Monday his stepdaughter, Marilise Bezuidenhout, was forced to convey the news of his possible death sentence ",World,Sports,Sports,Both wrong,World -> Sports,World -> Sports
"India's Tata makes powerful debut Shares  in Indian software services giant Tata Consultancy close 16 higher on their market debut, raising \$1.2bn for the company.",World,Business,Business,Both wrong,World -> Business,World -> Business
"MOM 2005 Released to Manufacturing Microsoft on Wednesday announced the release to manufacturing of Microsoft Operations Manager (MOM) 2005 and MOM 2005 Workgroup Edition, a new edition that the company previously called MOM 2005 Express.",Business,Sci/Tech,Sci/Tech,Both wrong,Business -> Sci/Tech,Business -> Sci/Tech
"Belarus Bank Denies Money Laundering Charge A bank in Belarus has denied US charges that it laundered money for former Iraqi leader Saddam Hussein. Infobank, in a statement, said it has strictly followed international agreements related to the fight against illegal transactions.",Business,World,World,Both wrong,Business -> World,Business -> World
Nepal blockade 'blow to tourism' Nepal tour operators say tourists cancelled millions of  dollars of bookings due to the rebel blockade of Kathmandu.,Business,World,World,Both wrong,Business -> World,Business -> World
TiVo loss widens SAN FRANCISCO (CBS.MW) - TiVo said its second-quarter loss widened from a year earlier on higher customer acquisition costs. Free!,Sci/Tech,Business,Business,Both wrong,Sci/Tech -> Business,Sci/Tech -> Business
US edge out Brazil for gold The United States beat Brazil 2-1 in extra time to win the women's Olympic football tournament.,World,Sports,Sports,Both wrong,World -> Sports,World -> Sports
"Dominicans' Swift Step Into Crisis SANTO DOMINGO, Dominican Republic -- When Sandro Batista smashed his banana truck into a tree in April, leaving him with two hideously shattered legs and a broken arm, his orthopedic surgeon sent his sister shopping.",Business,World,World,Both wrong,Business -> World,Business -> World
"US economic growth slips to 2.8 Annual US economic growth fell to 2.8 in the second quarter of 2004, marking a slowdown from the 3 estimated a month ago.",World,Business,Business,Both wrong,World -> Business,World -> Business
"HP to tempt holiday shoppers with sights and sounds The computer-hardware giant, best known for products such as PCs and printers, on Friday laid out its plan to become a brand-name in consumer electronics products such as flat-screen TVs, music players and the devices that move content between them.",Business,Sci/Tech,Sci/Tech,Both wrong,Business -> Sci/Tech,Business -> Sci/Tech
"Argentina Beats U.S. Men's Basketball Team Argentina defeated the United States team of National Basketball Association stars 89-81 here Friday in the Olympic semi-finals, dethroning the three-time defending champions.",World,Sports,Sports,Both wrong,World -> Sports,World -> Sports
"Siemens Says Cellphone Flaw May Hurt Users and Its Profit Siemens, the world #39;s fourth-largest maker of mobile phones, said Friday that a software flaw that can create a piercing ring in its newest phone models might hurt earnings in its handset division.",Business,Sci/Tech,Sci/Tech,Both wrong,Business -> Sci/Tech,Business -> Sci/Tech
"Bea Arthur for President Bea Arthur sparked a security scare at Logan Airport in Boston this week when she tried to board a Cape Air flight with a pocketknife in her handbag.    The ""Golden Girls"" star, now 81, was flagged by a Transportation Security Administration agent, who discovered the knife - a strict no-no following 9/11.    ""She started yelling that it wasn't hers and said 'The terrorists put it there,' "" a fellow passenger said. ""She kept yelling about the 'terrorists, the terrorists, the terrorists.' ""    After the blade was confiscated, Arthur took a keyring from her bag and told the agent it belonged to the ""terrorists,"" before throwing it at them.  - via philly.com",Sci/Tech,World,Business,Both wrong,Sci/Tech -> World,Sci/Tech -> Business
The Hunt for a Hybrid The Aug. 23 front-page article on the Toyota Prius vs. the Honda Civic implied that the main reason people prefer the Prius was its  quot;geek-chic look quot; and the image buyers want.,Business,Sci/Tech,Sci/Tech,Both wrong,Business -> Sci/Tech,Business -> Sci/Tech
Our mobile margins will fall: Telstra TELSTRA chief financial officer John Stanhope has admitted Telstra #39;s margins in its \$4.5 billion a year mobile phone business will shrink this year in the face of increased price competition and the growing cost of acquiring new customers.,Sci/Tech,Business,Business,Both wrong,Sci/Tech -> Business,Sci/Tech -> Business
"For Now, Unwired Means Unlisted. That May Change. In October, most major cellphone carriers plan to start compiling a publicly accessible listing of wireless phone numbers.",Business,Sci/Tech,Sci/Tech,Both wrong,Business -> Sci/Tech,Business -> Sci/Tech
"On TV -- from the Internet  SAN MATEO, Calif. -- The promise of Internet-based video has long been hamstrung by copyright and piracy worries, slow dial-up connections, technical challenges, and consumer disdain for watching blotchy videos on their home computers.",Business,Sci/Tech,Sci/Tech,Both wrong,Business -> Sci/Tech,Business -> Sci/Tech
"Intel in new chip breakthrough Intel creates a more powerful memory chip without increasing its size, confounding the firm's critics.",Business,Sci/Tech,Sci/Tech,Both wrong,Business -> Sci/Tech,Business -> Sci/Tech
Bryant Makes First Appearance at Trial (AP) AP - NBA star Kobe Bryant arrived at his sexual assault trial Monday as attorneys in the case who spent the weekend poring over questionnaires prepared to question potential jurors individually.,Sci/Tech,Sports,Sports,Both wrong,Sci/Tech -> Sports,Sci/Tech -> Sports
"Iraqi oil exports slump: report NEAR daily attacks on pipelines and pumping stations had pushed down Iraq #39;s oil exports to their lowest point in nearly a year, Britain #39;s Financial Times newspaper reported today.",World,Business,Business,Both wrong,World -> Business,World -> Business
"Japan should outsource more The Japanese information services industry clocked up sales of 13,703.9 billion yen in fiscal 2001, according to a report on selected service industries for 2001 released by the Ministry of Economy, Trade and Industry (METI).",World,Business,Business,Both wrong,World -> Business,World -> Business
Hall of Shame   Hall of Fame We spotlight people and products that pester us...and the heroes saving us from annoyances.,Sci/Tech,Sports,Sports,Both wrong,Sci/Tech -> Sports,Sci/Tech -> Sports
"Maddux Wins No. 302, Baker Wins No. 1,000 Greg Maddux pitched the Chicago Cubs into the lead in the NL wild-card race and gave Dusty Baker a win to remember. Maddux threw seven shutout innings for his 302nd career win, Baker got his 1,000th victory as a manager and Chicago beat the Montreal Expos 5-2 on Monday night...",World,Sports,Sports,Both wrong,World -> Sports,World -> Sports
"Make hotels just like home HOTEL operators, take note: Todays hotel guests are making a nonsense of room-pricing strategies with their aggressive, Internet-aided discount-hunting.",Sci/Tech,Business,Business,Both wrong,Sci/Tech -> Business,Sci/Tech -> Business
Strong Hurricane Roars Over Bahamas Toward Florida (Reuters) Reuters - Hurricane Frances battered the\southeastern Bahamas islands with 140 mph winds on Wednesday as\it roared toward the United States and put millions of people\on alert along Florida's heavily populated east coast.,Sci/Tech,World,World,Both wrong,Sci/Tech -> World,Sci/Tech -> World
Software Service Aims to Outfox Caller ID A new computerized service enables customers to create phony outbound phone numbers in order to mask their telephone identities.,Business,Sci/Tech,Sci/Tech,Both wrong,Business -> Sci/Tech,Business -> Sci/Tech
"Red Hat replaces CFO Red Hat on Thursday named Charles Peters Jr. as executive vice president and chief financial officer. Peters replaces Kevin Thompson, who unexpectedly announced his resignation in June, a few days before the ",Business,Sci/Tech,Sci/Tech,Both wrong,Business -> Sci/Tech,Business -> Sci/Tech
Megawati kicks off 36th ASEAN economic meeting JAKARTA (Agencies): President Megawati Soekarnoputri opened high-level economic talks between members of the Association of Southeast Asian Nations (ASEAN) on Friday with a warning to ASEAN leaders that they must stay the course on their agreed ,Business,World,World,Both wrong,Business -> World,Business -> World
The Bahamas - the real medal winner of the Athens Olympics A different way of calculating the medal standings brings some interesting results.,Sci/Tech,Sports,Sports,Both wrong,Sci/Tech -> Sports,Sci/Tech -> Sports
EU foreign ministers hope to break deadlock over ASEM summit The European Union said Friday it  quot;hoped to reach a conclusion quot; at a meeting of foreign ministers on the participation of military-ruled Myanmar in an upcoming summit of Asian and European nations.,Business,World,World,Both wrong,Business -> World,Business -> World
"ASEAN moves closer to single market with  #39;road map #39;, global trade &lt;b&gt;...&lt;/b&gt; JAKARTA : ASEAN finance ministers ended a meeting which saw Southeast Asia edge closer to a Europe-style single market, laying out a  quot;road map quot; for integration and opening doors to wider global trade.",World,Business,Business,Both wrong,World -> Business,World -> Business
"World briefs LONDON - A man wielding a machete and a knife attacked two security guards at the building housing the headquarters of the British domestic intelligence service MI5 on Friday, police said.",Business,World,World,Both wrong,Business -> World,Business -> World
Retailers Looking to Move Plasma TV's (AP) AP - Hanging stockings by the chimney with care? Retailers hope that St. Nicholas soon will be there  #151; to hang a 42-inch plasma-screen TV.,Business,Sci/Tech,Sci/Tech,Both wrong,Business -> Sci/Tech,Business -> Sci/Tech
"Philippines mourns dead in Russian school siege The Philippines Saturday expressed quot;deepest sympathy quot; to the families of the dead in the Russian school siege on Friday, in which 322 people were killed when Russian troops stormed ",Sci/Tech,World,World,Both wrong,Sci/Tech -> World,Sci/Tech -> World
"Dell cuts prices on many corporate products Dell on Monday said it had cut prices by as much as fifth for a range of products aimed at US corporate customers, as the computer maker passed along savings from cheaper components.",Sci/Tech,Business,Business,Both wrong,Sci/Tech -> Business,Sci/Tech -> Business
Drug makers target counterfeits Big pharmaceutical companies are testing new tracking technology they hope will help them spot counterfeit drugs before they reach consumers' medicine cabinets.,Business,Sci/Tech,Sci/Tech,Both wrong,Business -> Sci/Tech,Business -> Sci/Tech
"Israel to close Erez industrial zone before March Israel would start liquidating the Erez industrial zone in the northern Gaza Strip before launching the first stage of the disengagement plan in March 2005,local newspaper Ha #39;aretz reported on Tuesday.",Business,World,World,Both wrong,Business -> World,Business -> World
Florida deaths blamed on Hurricane Frances State and local officials Tuesday said nine people have died in Florida because of Hurricane Frances. The following describes those deaths: - A 15-year-old grandson and a former son ,Sports,World,World,Both wrong,Sports -> World,Sports -> World
"Hyundai signs deal for China truck plant Hyundai Motor Co. said yesterday that it has signed an agreement with a Chinese company, Jianghuai Automobile Corp., to build a commercial vehicle and engine plant in China #39;s Anhui province.",Sci/Tech,Business,Business,Both wrong,Sci/Tech -> Business,Sci/Tech -> Business
"Groups Offers Beer for Blood Donations (AP) AP - Some in Michigan who roll up their sleeves to donate blood will get a racetrack T-shirt, hat and pin. Sponsors in San Diego have given away whale-watching trips. On Wednesday, the Cleveland Regional Transit Authority handed out vouchers for a pint of any beverage, including beer, in exchange for a pint of blood.",Sci/Tech,World,Sports,Both wrong,Sci/Tech -> World,Sci/Tech -> Sports
Florida Starts To Recover in the Wake of Hurricane Frances President Bush will travel to Florida Wednesday to survey damage from Hurricane Frances. He sent a letter to Congress asking for \$2 billion to help with recovery efforts.,Sci/Tech,World,World,Both wrong,Sci/Tech -> World,Sci/Tech -> World
Telescope snaps distant 'planet' The first direct image of a planet circling another star may have been obtained by a US-European team of astronomers.,World,Sci/Tech,Sci/Tech,Both wrong,World -> Sci/Tech,World -> Sci/Tech
Tough to predict a hurricane landfall this season #39;s busy season of landfalling Atlantic hurricanes has seen a few less-than-perfect calls by tropical ,Sci/Tech,Sports,Business,Both wrong,Sci/Tech -> Sports,Sci/Tech -> Business
"Post-Olympic Greece tightens purse, sells family silver to fill budget holes (AFP) AFP - Squeezed by a swelling public deficit and debt following last month's costly Athens Olympics, the Greek government said it would cut defence spending and boost revenue by 1.5 billion euros (1.84 billion dollars) in privatisation receipts.",Business,World,World,Both wrong,Business -> World,Business -> World
"At Last, Success on the Road for Lions The Detroit Lions went three full seasons without winning an away game, setting an NFL record for road futility. They ended that ignominious streak Sunday in their first opportunity of the season, beating the Chicago Bears 20-16 at Soldier Field...",World,Sports,Sports,Both wrong,World -> Sports,World -> Sports
"EU increases pressure for rights in Myanmar EU foreign ministers agreed Monday to tighten sanctions against Myanmar if it does not improve its human rights record by Oct. 8, when an EU meeting with Asian countries starts in Vietnam.",Business,World,World,Both wrong,Business -> World,Business -> World
"German investor confidence slumped in September BERLIN - German investor confidence dropped sharply in September, a key economic indicator released Tuesday showed amid concerns about the impact of high oil prices on consumer demand and the outlook for the global economy.",World,Business,Business,Both wrong,World -> Business,World -> Business
"Study: 400K Fewer Tech Jobs Since 2001 The US information tech sector lost 403,300 jobs between March 2001 and this past April, and the market for tech workers remains bleak, according to a new report.",Business,Sci/Tech,Sci/Tech,Both wrong,Business -> Sci/Tech,Business -> Sci/Tech
"Slowing population 'lacks funds' Rich countries are giving only half the amount they promised to help to slow world population growth, the UN says.",Sci/Tech,Business,World,Both wrong,Sci/Tech -> Business,Sci/Tech -> World
'Cities in crisis' leaders warn World leaders warn that rapid urbanisation will become one of the biggest challenges of the 21st Century.,Sci/Tech,World,World,Both wrong,Sci/Tech -> World,Sci/Tech -> World
"HP Wins Defense Contract HP (Quote, Chart) was awarded a \$290 million, 10-year outsourcing contract with the Defense Logistics Agency #39;s (DLA) Enterprise Data Center (EDC) program, officials announced Wednesday.",Business,Sci/Tech,Sci/Tech,Both wrong,Business -> Sci/Tech,Business -> Sci/Tech
Infineon to Pay a Fine in the Fixing Of Chip Prices Federal prosecutors announced on Wednesday that they had cracked a global cartel that had illegally fixed prices of memory chips in personal computers and servers for ,Business,Sci/Tech,Sci/Tech,Both wrong,Business -> Sci/Tech,Business -> Sci/Tech
"Icing call Out of money, out of patience, out of time, and for the foreseeable future, out of business.",Sports,Business,Business,Both wrong,Sports -> Business,Sports -> Business
Infineon admits conspiracy in DRAM cartel GIANT MEMORY company Infineon will plead guilty to price fixing of DRAM chips and will pay \$160 million in fines to the US government.,Business,Sci/Tech,Sci/Tech,Both wrong,Business -> Sci/Tech,Business -> Sci/Tech
"Netopia to Restate Results (Reuters) Reuters - Netopia Inc.  a maker of\networking gear, on Thursday said its auditor KPMG LLP\resigned, and said it will restate two years of results and\revise the results in its most recent fiscal quarter.",Sci/Tech,Business,Business,Both wrong,Sci/Tech -> Business,Sci/Tech -> Business
"Hurricane Ivan Slams U.S. Gulf Coast Hurricane Ivan roared into the Gulf Coast near Mobile, Alabama, early this morning with peak winds exceeding 125 miles an hour (200 kilometers an hour).",Sci/Tech,World,World,Both wrong,Sci/Tech -> World,Sci/Tech -> World
"Texas Instruments Plans Buyback (Reuters) Reuters - Texas Instruments Inc., the\largest maker of chips for cellular phones, on Thursday said it\plans to buy back  #36;1 billion in stock and boost its quarterly\dividend by more than 17 percent, becoming the latest\technology company to return extra cash to investors.",Sci/Tech,Business,Business,Both wrong,Sci/Tech -> Business,Sci/Tech -> Business
"Forecasters: More Hurricanes May Be on Way Ivan, Frances and Charley delivered three staggering blows to the Gulf Coast and Florida, as well as Caribbean island nations, all in just five weeks.",Sci/Tech,Business,Business,Both wrong,Sci/Tech -> Business,Sci/Tech -> Business
Boxer Begs Bush to Back Bum Bill Members of California's congressional team make one last effort to look good for the tech industry back home.,Business,Sci/Tech,Sci/Tech,Both wrong,Business -> Sci/Tech,Business -> Sci/Tech
"Show lights up Paralympics The XII Paralympics begins in Athens, after a spectacular opening ceremony.",World,Sports,Sports,Both wrong,World -> Sports,World -> Sports
"Thanks for the Pageviews, Ivan Bad weather has been very good for business at Weather.com and other popular forecasting sites. They are posting record traffic in the wake of Hurricane Ivan's arrival on the mainland. By Joanna Glasner.",Business,Sci/Tech,Sci/Tech,Both wrong,Business -> Sci/Tech,Business -> Sci/Tech
"Florida, Alabama pick up the pieces after Ivan People in Florida and Alabama have started to clean up after hurricane Ivan - the third such pummelling for Florida alone in just five weeks.",Business,World,World,Both wrong,Business -> World,Business -> World
Ryder Cup: Europe close on victory Another good day at Oakland Hills sees Europe move 11-5 clear of the USA going into Sunday's Ryder Cup singles.,World,Sports,Sports,Both wrong,World -> Sports,World -> Sports
VoIP becomes new option Jackson is one of the first to take advantage of Time Warner Cable #39;s new venture into Voice over Internet Provider (VoIP) telephone service here and she says it works great.,Business,Sci/Tech,Sci/Tech,Both wrong,Business -> Sci/Tech,Business -> Sci/Tech
Malaysia expects to resume poultry exports to Singapore soon By Channel NewsAsia #39;s Malaysia Correspondent Melissa Goh. KUALA LUMPUR : Malaysia expects to resume export of poultry and eggs from two states to Singapore by the end of this month but only after meeting conditions set by the island.,World,Business,Business,Both wrong,World -> Business,World -> Business
"Rogers Wireless Whistles and Fido Responds Its official. Microcell Telecommunications Fido wireless service will be the new dog in Rogers Wireless Communications Canadian kennel, and that puppy wasnt cheap.",Business,Sci/Tech,Sci/Tech,Both wrong,Business -> Sci/Tech,Business -> Sci/Tech
