text,true_label,lr_pred,bert_pred,case,lr_confusion_pair,bert_confusion_pair
"AOL pushes into Internet shopping Looking for new ways to boost its revenue, America Online is launching an online shopping service that won #39;t require an AOL account to access.",Business,Sci/Tech,Sci/Tech,Both wrong,Business -> Sci/Tech,Business -> Sci/Tech
Bush Scraps Most U.S. Sanctions on Libya (Reuters) Reuters - President Bush on Monday formally\ended the U.S. trade embargo on Libya to reward it for giving\up weapons of mass destruction but left in place U.S.\terrorism-related sanctions.,Sci/Tech,World,World,Both wrong,Sci/Tech -> World,Sci/Tech -> World
"Study: Wrecks Jump 3 Days After Terrorism Fatal traffic accidents increase sharply in Israel on the third day after a terrorist attack, and researchers are searching for an explanation why.",Sci/Tech,World,World,Both wrong,Sci/Tech -> World,Sci/Tech -> World
"Clouds darken PeopleSoft conference SAN FRANCISCO -- PeopleSoft Inc. is trying to create a party-like atmosphere at its annual customer conference, but this week's gathering may feel more like a wake with rival Oracle Corp.'s \$7.7 billion takeover bid looming larger than ever.",Business,Sci/Tech,Sci/Tech,Both wrong,Business -> Sci/Tech,Business -> Sci/Tech
"Ask Jeeves retools search engine in bid to catch Google, Yahoo SAN FRANCISCO -- Hoping to emerge from the shadow of its more popular rivals, Ask Jeeves Inc. is adding new tools for visitors to save and organize links to Web pages they find through the company's online search engine.",Business,Sci/Tech,Sci/Tech,Both wrong,Business -> Sci/Tech,Business -> Sci/Tech
"PeopleSoft CEO Conway maintains defiant tone SEPTEMBER 21, 2004 (IDG NEWS SERVICE) - With 15,000 attendees at PeopleSoft Inc. #39;s Connect 2004 user show waiting to hear how the company would handle Oracle Corp.",Business,Sci/Tech,Sci/Tech,Both wrong,Business -> Sci/Tech,Business -> Sci/Tech
"Senate Panel Gives NASA Extra Money (AP) AP - NASA would get  #36;16.4 billion next year under a bill a Senate committee approved Tuesday, reversing a decision by House lawmakers to cut the space agency's budget below this year's levels.",World,Sci/Tech,Sci/Tech,Both wrong,World -> Sci/Tech,World -> Sci/Tech
"Spread of GM grass raises fears of crossbreeding Pollen from a genetically modified grass was found 21 kilometres from where it was planted, scientists reported in a study published Tuesday, raising fears of transgenic crossbreeding.",Business,Sci/Tech,Sci/Tech,Both wrong,Business -> Sci/Tech,Business -> Sci/Tech
"Asia to outperform this year, lower growth seen in 2005: ADB (AFP) AFP - Developing Asia is set to outperform this year with higher-than-expected growth of 7.0 percent despite high oil prices but it will slow in 2005 in tandem with the developed world, the Asian Development Bank (ADB) said.",World,Business,Business,Both wrong,World -> Business,World -> Business
"PeopleSofts big bash See you next year in Las Vegas , proclaimed a marquee at the PeopleSoft user conference in San Francisco in late September. It was one of many not-so-subtle attempts by the company to reassure its customers ",Business,Sci/Tech,Sci/Tech,Both wrong,Business -> Sci/Tech,Business -> Sci/Tech
"Deal in Congress to Keep Tax Cuts, Widening Deficit Republican and Democratic leaders agreed to extend \$150 billion worth of tax cuts sought by President Bush without trying to pay for them.",World,Business,Business,Both wrong,World -> Business,World -> Business
Rumours surround Google browser The search giant Google is rumoured to be working on its own web browser.,Business,Sci/Tech,Sci/Tech,Both wrong,Business -> Sci/Tech,Business -> Sci/Tech
"PeopleSoft Plays Defense The business software maker inks a deal with IBM, but it isn't likely to dissuade Oracle.",Business,Sci/Tech,Sci/Tech,Both wrong,Business -> Sci/Tech,Business -> Sci/Tech
Islands press Govt to reverse phone call decision Diplomats from a number of islands in the South Pacific are reported to be pressing the Government to reverse a decision to block all phone calls made to the islands.,Sci/Tech,World,World,Both wrong,Sci/Tech -> World,Sci/Tech -> World
"Dogs said to smell cancer signs  LONDON -- It has long been suspected that man's best friend has a special ability to sense when something is wrong with us. Now, the first experiment to verify that scientifically has demonstrated that dogs are able to smell cancer.",World,Sci/Tech,Sci/Tech,Both wrong,World -> Sci/Tech,World -> Sci/Tech
Baby for ovary transplant woman A Belgian cancer patient made infertile by chemotherapy has given birth following revolutionary treatment.,Sci/Tech,World,World,Both wrong,Sci/Tech -> World,Sci/Tech -> World
"Mom Hugs 'Miracle' Baby After Ovarian Transplant (Reuters) Reuters - Ouarda Touirat, her day-old baby\daughter nestling in her arms, said Friday she had never lost\hope that she could conceive after cancer treatment left her\infertile.",Sci/Tech,World,World,Both wrong,Sci/Tech -> World,Sci/Tech -> World
"Soldiers' War Blogs Detail Life in Iraq Iraq war blogs are as varied as the soldiers who write them. Some sites feature practical news, war pictures and advice. Some are overtly political, with more slanting to the right than to the left. Some question the war, some cheer it.",Sci/Tech,World,World,Both wrong,Sci/Tech -> World,Sci/Tech -> World
A wandering Congress trips over the US Constitution That is the one-word message of advice that citizens wanted to send to members of Congress at the end of last week. Both the House of Representatives and the Senate looked as if they are having trouble seizing ,Business,World,World,Both wrong,Business -> World,Business -> World
"Adobe updates RAW plug-in with digital negative format Adobe has updated Photoshop #39;s support for digital cameras #39; RAW image formats. The new plug-in adds to the number of camera models supported and includes a utility for converting images into the DNG, digital negative format.",Business,Sci/Tech,Sci/Tech,Both wrong,Business -> Sci/Tech,Business -> Sci/Tech
"Plan B Proposes Its Own Alternatives Donnie Downs, president and chief executive of Plan B Technologies Inc., said the company itself is a ""plan B.""",Sci/Tech,Business,Business,Both wrong,Sci/Tech -> Business,Sci/Tech -> Business
SC to hear Zee petition tommorrow Five judges of the top court will hear a petition filed by Zee Telefilms on Tuesday. A three-judge panel of the Supreme Court said a five-judge bench would hear the dispute that threatens the rights of India #39;s ,Sports,Business,Business,Both wrong,Sports -> Business,Sports -> Business
"Dell, AOL team up in schools initiative ROUND ROCK, Texas -- Dell Inc. and America Online Inc. announced a partnership Monday to provide 5,000 low-income students with free refurbished personal computers and a year #39;s worth of Internet access.",Business,Sci/Tech,Sci/Tech,Both wrong,Business -> Sci/Tech,Business -> Sci/Tech
"Embattled Mortgage Giant Agrees to Meet New Standards Fannie Mae agreed to keep more cash on hand while it corrects accounting problems, a U.S. regulator said.",World,Business,Business,Both wrong,World -> Business,World -> Business
"Gas prices up 5 cents after Hurricane Ivan CAMARILLO, Calif. - Gas prices jumped more than 5 cents a gallon in the past two weeks, largely because of supply problems related to Hurricane Ivan, an industry analyst said.",Sci/Tech,Business,Business,Both wrong,Sci/Tech -> Business,Sci/Tech -> Business
"Nigerian oil flows despite rebel threat-companies Oil should continue to flow from Nigeria, the world #39;s seventh largest exporter, despite a rebel threat to attack foreign oil workers in an  quot;all-out war quot; due to start on Friday, multinational energy companies said.",World,Business,Business,Both wrong,World -> Business,World -> Business
Oil Companies In Nigeria Say They Won #39;t Give In To Threats Major oil companies operating in Nigeria #39;s oil-rich southern region say they will not give in to threats of attacks on their facilities and employees by militias.,World,Business,Business,Both wrong,World -> Business,World -> Business
"Virgin Starts (70) Mile-High Club With the misery that has plagued the airline industry recently, the last place you #39;d expect to see some inspiring -- heck, potentially rule-breaking -- thinking would be from an airline entrepreneur.",Sci/Tech,Business,Business,Both wrong,Sci/Tech -> Business,Sci/Tech -> Business
"Cendant Near Deal to Buy Orbitz for  #36;1.2 Bln-Source (Reuters) Reuters - Travel and real estate company\Cendant Corp.  is close to an agreement to buy online\travel site Orbitz Inc.  for about  #36;1.2 billion in\cash, a source close to the talks said on Tuesday.",Sci/Tech,Business,Business,Both wrong,Sci/Tech -> Business,Sci/Tech -> Business
Amazon sues spammers for misleading consumers SEATTLE -- Amazon.com has filed three lawsuits in King County Superior Court against unidentified defendants who allegedly forged e-mails and Web sites to fool consumers into thinking they are doing business with the Internet retailer.,Business,Sci/Tech,Sci/Tech,Both wrong,Business -> Sci/Tech,Business -> Sci/Tech
"New \$50 bill designed to counter counterfeits WASHINGTON - The green is still there, but with touches of blue, red and yellow. A stylized image of the Stars and Stripes now waves in the background.",Business,Sci/Tech,Sci/Tech,Both wrong,Business -> Sci/Tech,Business -> Sci/Tech
"BlueGene sneaks past Earth Simulator The Earth Simulator, an NEC supercomputer, is surpassed, at last. IBM announced yesterday that its Blue Gene/L supercomputer had achieved a sustained performance of 36.",Business,Sci/Tech,Sci/Tech,Both wrong,Business -> Sci/Tech,Business -> Sci/Tech
Travelzoo Shares Rise as Offering Rumor Fades (Reuters) Reuters - Shares of Internet travel site\Travelzoo Inc.  rose nearly 4 percent on Wednesday as\market rumors of a secondary stock offering faded.,Sci/Tech,Business,Business,Both wrong,Sci/Tech -> Business,Sci/Tech -> Business
I.B.M. Agrees to Settle Part of Giant Pension Case I.B.M. said that it had agreed to pay \$320 million to its employees to settle in part a class-action lawsuit over its pension plan.,Sci/Tech,Business,Business,Both wrong,Sci/Tech -> Business,Sci/Tech -> Business
"Immunity in Ebbers Case Opposed in U.S. Filing NEW YORK, Sept. 29 -- Federal prosecutors told a judge in a filing late Tuesday night that they have evidence that former WorldCom Inc. chief executive Bernard J. Ebbers knew company officials had improperly tinkered with the telecommunications firm's accounting to boost its publicly reported profits.",Sci/Tech,Business,Business,Both wrong,Sci/Tech -> Business,Sci/Tech -> Business
"Poor? Who #39;s poor? Poverty is down The proportion of people living on less than \$1 a day decreased from 40 to 21 per cent of the global population between 1981 and 2001, says the World Bank #39;s latest annual report.",World,Business,Business,Both wrong,World -> Business,World -> Business
"IBM Claims Its BlueGene Supercomputer Is the Fastest IBM Corp. on Wednesday said it has developed the world #39;s fastest computer - a 16,000-processor version of its BlueGene/L supercomputer.",Business,Sci/Tech,Sci/Tech,Both wrong,Business -> Sci/Tech,Business -> Sci/Tech
"Man arrested for fatally stabbing elderly parents SAITAMA -- A middle-aged man who fatally stabbed his parents has been arrested, police said. Hideo Nakajima, an unemployed man from Soka, Saitama Prefecture, apparently called police shortly before 8 pm, Wednesday.",Sci/Tech,World,World,Both wrong,Sci/Tech -> World,Sci/Tech -> World
"Tough Talks Ahead After EU Is Criticized Efforts to forge the world's largest free trade zone between the European Union and South America's Mercosur economic bloc are unlikely to be concluded by an Oct. 31 deadline, the EU said Thursday, with both sides declaring each other's trade offers insufficient.",World,Business,Business,Both wrong,World -> Business,World -> Business
"Pharma Groups Work on EPC Issues Sept. 30, 2004Reacting to calls from pharmaceutical retailers, distributors and manufacturers, EPCglobal has added a new action group to specifically study the pharmaceutical industry ",Sci/Tech,Business,Business,Both wrong,Sci/Tech -> Business,Sci/Tech -> Business
"August Chip Sales Growth Slows on High Inventory  SAN FRANCISCO (Reuters) - Global semiconductor sales growth  slowed to 1 percent in August as electronics makers reacted to  growing inventories in Asia by limiting orders of chips, an  industry trade group said on Thursday.",Sci/Tech,Business,Business,Both wrong,Sci/Tech -> Business,Sci/Tech -> Business
"Hasbro's No Conehead Its Saturday Night Live version of ""Trivial Pursuit"" is good strategy for staying ahead of age compression.",Business,Sports,Sci/Tech,Both wrong,Business -> Sports,Business -> Sci/Tech
"Opportunity Rings (Forbes.com) Forbes.com - This past summer 25,000 consumers, aged 18 to 24, received short text messages on their cell phones alerting them to numbers on 225 million bottle caps of Snapple iced tea, pink lemonade and the like. People holding a winning number, announced by text message and traditional media, landed overseas trips and walk-on parts on TV shows.",Sci/Tech,Business,Business,Both wrong,Sci/Tech -> Business,Sci/Tech -> Business
"Hewlett-Packard buys Synstar Palo Alto-based Hewlett-Packard Co. has bought IT services company Synstar plc, of Bracknell, England for about \$293.3 million. Synstar has some 1,500 customers across Europe, selling IT support for various computer platforms.",Business,Sci/Tech,Sci/Tech,Both wrong,Business -> Sci/Tech,Business -> Sci/Tech
Research Is Definitely in Motion The Blackberry wireless device maker is straining to exceed expectations.,Business,Sci/Tech,Sci/Tech,Both wrong,Business -> Sci/Tech,Business -> Sci/Tech
Bangkok animal trade talks open The rules controlling the trade in many at-risk wildlife species may change at a Bangkok meeting starting on Saturday. The 166 member states of the Convention on International Trade in Endangered Species of ,World,Sci/Tech,Sci/Tech,Both wrong,World -> Sci/Tech,World -> Sci/Tech
"Corporate Krueger haunts PeopleSoft A few weeks ago the then-CEO of PeopleSoft, Craig Conway, posed the following question to attendees at a technology conference:  quot;Have you ever had a bad dream that never ended?",Business,Sci/Tech,Sci/Tech,Both wrong,Business -> Sci/Tech,Business -> Sci/Tech
"You have mail, always, with a BlackBerry Washington lawyer William Wilhelm knows from experience that not everybody loves his BlackBerry as much as he does. The girlfriend was fed up with a relationship ",Sci/Tech,Business,Business,Both wrong,Sci/Tech -> Business,Sci/Tech -> Business
"Nikkei Opens Higher (Reuters) Reuters - The Nikkei average rose 1.37 percent at\the opening on Monday as a recovery in U.S. stocks encouraged\investors to seek bargains among lagging issues, including\Canon Inc. and other high-tech issues.",World,Business,Business,Both wrong,World -> Business,World -> Business
Brewers buyer expected to step out of the shadows Monday MILWAUKEE - Paul Attanasio says the story of his brother buying a baseball team is like a script straight out of Hollywood. He should know.,Business,Sports,Sports,Both wrong,Business -> Sports,Business -> Sports
"Fable; Nascar 2005: Chase For The Cup Fable comes with a big reputation behind it -- it was developed by Peter Molyneux, creator of such involved, engrossing games as Populous and Black and White.",Sci/Tech,Sports,Sports,Both wrong,Sci/Tech -> Sports,Sci/Tech -> Sports
"SBC links e-mail, voice messages, fax SBC on Monday announced a new service that integrates voice messages, faxes and e-mails into a single mailbox that can be accessed from anywhere by phone or the Internet.",Business,Sci/Tech,Sci/Tech,Both wrong,Business -> Sci/Tech,Business -> Sci/Tech
OPM Delving Deeper Into Employees #39; Backgrounds which sets hiring and employment standards for the government -- is reviewing its employees to ensure that they are suitable for jobs involving the  quot;public trust.,Sci/Tech,Business,Business,Both wrong,Sci/Tech -> Business,Sci/Tech -> Business
"PeopleSoft down on testimony, forecast Investors react to a disappointing earnings projection and to testimony that dampens hopes of negotiations with Oracle.",Sci/Tech,Business,Business,Both wrong,Sci/Tech -> Business,Sci/Tech -> Business
"New Siebel Chief Outlines Chapter 2 For CRM Vendor After 10 years of focusing on product development and delivery, CEO Michael Lawrie says Siebel had to recognize that technology is only one part of the CRM equation.",Business,Sci/Tech,Sci/Tech,Both wrong,Business -> Sci/Tech,Business -> Sci/Tech
"Feds kick off digital TV consumer campaign WASHINGTON - It #39;s one of the biggest technical changes in television since color TV: the digital transition. And because many Americans remain in the dark about it, federal regulators began an education campaign Monday to enlighten them.",Business,Sci/Tech,Sci/Tech,Both wrong,Business -> Sci/Tech,Business -> Sci/Tech
"Russia May Ratify Kyoto Protocol in Oct. -- Minister (Reuters) Reuters - The Russian government expects\parliament to ratify the Kyoto Protocol this month in a move\allowing the long-delayed climate change treaty to come into\force worldwide, a senior minister said Monday.",Sci/Tech,World,World,Both wrong,Sci/Tech -> World,Sci/Tech -> World
webcrawler: A9.com is cool NOW heres something else thats off the mind. Theres no more need to make mental or computer notes while searching the Internet.,Business,Sci/Tech,Sci/Tech,Both wrong,Business -> Sci/Tech,Business -> Sci/Tech
How to take the perfect penalty A sports psychologist says how footballers should prepare themselves for the high-pressure penalties.,Sci/Tech,Sports,Sports,Both wrong,Sci/Tech -> Sports,Sci/Tech -> Sports
"CA to buy Netegrity for \$430 million com October 6, 2004, 7:36 AM PT. This fourth priority #39;s main focus has been improving or obtaining CRM and ERP software for the past year and a half.",Business,Sci/Tech,Sci/Tech,Both wrong,Business -> Sci/Tech,Business -> Sci/Tech
Qatar Defense Show Focuses on Videogame Technology  DOHA (Reuters) - Rick Bracewell is driving through Baghdad  when gunmen open fire. Then a nearby dead dog strapped with  explosives blows up and his vehicle goes up in flames.,Sci/Tech,World,World,Both wrong,Sci/Tech -> World,Sci/Tech -> World
"Ex-Bush Official on Cybersecurity Returns (AP) AP - Howard Schmidt, a highly regarded technology executive who was former special adviser to President Bush for cybersecurity, is returning to work with the Homeland Security Department on efforts to protect the nation's computer networks.",World,Sci/Tech,Sci/Tech,Both wrong,World -> Sci/Tech,World -> Sci/Tech
"Howard Stern Says He Plans to Jump to Satellite Radio After heavy F.C.C. fines, Howard Stern expects to deliver ""my show my way"" in the mostly unregulated medium.",World,Business,Business,Both wrong,World -> Business,World -> Business
"34 tech firms sued for alleged LCD patent theft Honeywell has issued lawsuits against 34 companies, including Dell, Apple, Sony and Toshiba alleging LCD panels used in their products infringe a 1992 patent the company holds.",Business,Sci/Tech,Sci/Tech,Both wrong,Business -> Sci/Tech,Business -> Sci/Tech
"Unisys to lay off 1,400 workers Unisys Corp. plans to cut 1,400 jobs, primarily in general and administrative areas, and consolidate its office space worldwide, it announced Wednesday. The cuts represent 3.8 percent of the company's staff of 37,000.",Sci/Tech,Business,Business,Both wrong,Sci/Tech -> Business,Sci/Tech -> Business
"Nintendo to Unveil Handheld Upgrade Facing its biggest threat ever from the arrival of Sony Corp. in the portable video-game machine market, Japanese game-maker Nintendo Co.",Business,Sci/Tech,Sci/Tech,Both wrong,Business -> Sci/Tech,Business -> Sci/Tech
Sun settles Kodak patent suit Sun Microsystems says it will pay Kodak \$92 million to settle a high-profile patent suit involving Sun #39;s Java programming technology.,Business,Sci/Tech,Sci/Tech,Both wrong,Business -> Sci/Tech,Business -> Sci/Tech
"Lego, Carrefour in French Price-Fix Probe (AP) AP - French competition authorities are investigating Danish toy maker Lego Systems AS and supermarket retailer Carrefour SA as part of a probe into alleged price fixing in the French toy market in 2002 and early 2003.",Business,Sci/Tech,World,Both wrong,Business -> Sci/Tech,Business -> World
"Shock Jock Group Boosts Satellite Radio Profile When radio shock jocks Opie and Anthony considered their next career move after two firings in four years, the twisted twosome was ready to feign rehabilitation. Or at least that was the plan when they sat down with satellite radio executives.",Sci/Tech,Business,Business,Both wrong,Sci/Tech -> Business,Sci/Tech -> Business
"New pension 'would help millions' Britain's pension system could easily be replaced by a new payment that would make millions better off, a report says.",Business,Sci/Tech,World,Both wrong,Business -> Sci/Tech,Business -> World
Cellphone Industry Hits Snag as It Woos Untapped Market The mobile phone industry is turning its attention to the last untapped demographic - people over 65.,World,Sci/Tech,Sci/Tech,Both wrong,World -> Sci/Tech,World -> Sci/Tech
"Legendary all-rounder Miller dies Keith Miller, arguably Australia's greatest  all-rounder in Test cricket, has died in Melbourne aged 84.",World,Sports,Sports,Both wrong,World -> Sports,World -> Sports
"T-Online returns to Deutsche Telekom mothership German incumbent telco Deutsche Telekom announced over the weekend it is to begin taking its internet division, T-Online, back entirely within the mother corporation.",Business,Sci/Tech,Sci/Tech,Both wrong,Business -> Sci/Tech,Business -> Sci/Tech
Finnish Watchdog Raps TV Game Operators (Reuters) Reuters - Finland's consumer watchdog said on\Monday it had reprimanded broadcasters for causing children to\run up huge mobile phone bills with interactive television game\and chat programs.,World,Sci/Tech,Sci/Tech,Both wrong,World -> Sci/Tech,World -> Sci/Tech
"Linux: Paris weighs a shift to open-source camp PARIS The open-source computer system known as Linux won a tough battle over Microsoft earlier this year when the city of Munich decided to change the operating software of 14,000 government computers, despite the personal intervention of Steve Ballmer ",Business,Sci/Tech,Sci/Tech,Both wrong,Business -> Sci/Tech,Business -> Sci/Tech
"SKorea's Samsung to invest 24 billion dollars in new chip lines (AFP) AFP - South Korea's Samsung Electronics Co., the world's largest memory chipmaker, said it would invest some 24 billion dollars in building new chip production lines over the next six years.",World,Sci/Tech,Sci/Tech,Both wrong,World -> Sci/Tech,World -> Sci/Tech
"Kenyan Laureate Urges Rich Nations to Ratify Kyoto (Reuters) Reuters - Kenya's Nobel Peace Prize winner,\Wangari Maathai, on Monday urged wealthy nations to ratify the\Kyoto protocol on climate change to ease the burden of\pollution on poor countries.",Sci/Tech,World,World,Both wrong,Sci/Tech -> World,Sci/Tech -> World
"Oracle vs. PeopleSoft: Lies and Lying CEOs Who Tell Them PeopleSoft #39;s board knew that CEO Craig Conway had erred in his comments, so it filed a corrected version of the meeting transcript with the Securities and Exchange Commission.",Sci/Tech,Business,Business,Both wrong,Sci/Tech -> Business,Sci/Tech -> Business
"Microsoft Launches New Media Center PC Microsoft Corp. MSFT.O on Tuesday unveiled a new version of its Windows XP Media Center, adding features such as instant messaging and high-definition television to a personal computer designed for the living room.",Business,Sci/Tech,Sci/Tech,Both wrong,Business -> Sci/Tech,Business -> Sci/Tech
Rumors Suggest Photo Ability To Be Added to iPod  quot;Apple has invested heavily in technology to edit pictures. Not having a portable device to show them seemed an obvious oversight that would be corrected once the price of the displays ,Business,Sci/Tech,Sci/Tech,Both wrong,Business -> Sci/Tech,Business -> Sci/Tech
"DreamWorks Animation IPO Set at 29M Shares Underwriters for DreamWorks Animation SKG Inc., producer of the blockbuster ""Shrek"" movies, Tuesday set the terms of the company's pending initial public offering at 29 million common shares, with an estimated price range of \$23 to \$25 a share.",Sci/Tech,Business,Business,Both wrong,Sci/Tech -> Business,Sci/Tech -> Business
"Ljubicic Downs Hanescu at Open De Moselle Top-seeded Ivan Ljubicic of Croatia beat Victor Hanescu of Romania 6-4, 6-4 Tuesday in the first round of the Open de Moselle.",World,Sports,Sports,Both wrong,World -> Sports,World -> Sports
"Intel Posts Higher Profit, Sales Computer-chip maker Intel Corp. said yesterday that earnings for its third quarter were \$1.9 billion -- up 15 percent from the same quarter a year ago -- but the company cautioned that computer-processor demand in the United States is likely to remain low.",Sci/Tech,Business,Business,Both wrong,Sci/Tech -> Business,Sci/Tech -> Business
Ban for former Ahold executives Dutch  retailer Ahold's former chairman and its ex-finance officer are barred from executive posts as part of a US fraud case settlement.,World,Business,Business,Both wrong,World -> Business,World -> Business
"Thai minister says zoo #39;s illegal orangutans to be moved JAKARTA/BANGKOK (DPA): Thailand, under growing pressure to repatriate some 100 orangutans allegedly smuggled into the country from Indonesia, plans to shift the apes from a private zoo to a safe centre, probably in Chiang Mai, a minister said on Thursday.",Sci/Tech,World,World,Both wrong,Sci/Tech -> World,Sci/Tech -> World
