text,true_label,lr_pred,bert_pred,case,lr_confusion_pair,bert_confusion_pair
"Oil exports flow as strike woes ease A general strike in Nigeria, which has raised fears over oil supply from the world #39;s seventh-largest exporter, will likely end its first phase on Thursday  quot;all going well quot;, union leaders said.",World,Business,Business,Both wrong,World -> Business,World -> Business
"FCC exempts fiber-to-curb from sharing requirements The Federal Communications Commission Thursday voted to allow incumbent telephone carriers from sharing fiber-to-the-curb deployments from competitors, prompting one incumbent to announce an accelerated fiber rollout.",Business,Sci/Tech,Sci/Tech,Both wrong,Business -> Sci/Tech,Business -> Sci/Tech
"For Many Airline Pilots, the Thrill Is Gone While pilots still feel in command in the air, they increasingly are feeling slighted on the ground, as airlines extract salary and benefits concessions from them.",World,Business,Business,Both wrong,World -> Business,World -> Business
"Blockbuster Cuts Online Price, Challenges Netflix (Reuters) Reuters - Video chain Blockbuster Inc on\Friday said it would lower the price of its online DVD rentals\to undercut a similar move by Netflix Inc. that sparked a stock\a sell-off of both companies' shares.",Sci/Tech,Business,Business,Both wrong,Sci/Tech -> Business,Sci/Tech -> Business
"Sun posts narrower quarterly loss OCTOBER 14, 2004 (REUTERS) - SAN FRANCISCO -- Sun Microsystems Inc. today posted a narrower quarterly loss as revenue rose year over year for the second consecutive quarter after three years of declines, sending shares slightly higher.",Sci/Tech,Business,Business,Both wrong,Sci/Tech -> Business,Sci/Tech -> Business
"Toughest athlete is female and unknown You probably haven't heard about one of the toughest endurance sports around: the deca-ironman. That's 38 km swimming, immediately followed by an 1800 km bicycle ride and a 420 km run. Currently, the world record stands at about 187 hours, held by a German housewife. Nobody else has ever finished the course below 192 hours.  ",Sci/Tech,Sports,Sports,Both wrong,Sci/Tech -> Sports,Sci/Tech -> Sports
"US consumers unaware of spyware The findings come in a report from the newly formed Consumer Spyware Initiative, a joint effort by Dell and the non-profit Internet Education Foundation that aims to increase awareness of spyware.",Business,Sci/Tech,Sci/Tech,Both wrong,Business -> Sci/Tech,Business -> Sci/Tech
"Wi-Fi successor is called high-speed hype -- for now SAN FRANCISCO -- At virtually every turn, Intel Corp. executives are heaping praise on an emerging long-range wireless technology known as WiMAX, which can blanket entire cities with high-speed Internet access.",Business,Sci/Tech,Sci/Tech,Both wrong,Business -> Sci/Tech,Business -> Sci/Tech
"Calif. Mental Health Services May Expand (AP) AP - As pressures increase on California's mental health system, its workers and advocates say they are forced to do more with a supply of money that seems to shrink each year.",World,Sci/Tech,Sci/Tech,Both wrong,World -> Sci/Tech,World -> Sci/Tech
"Google puts desktop search privacy up front Google has announced a new desktop search application that enables users to search their e-mail, files, web history, and chats. Perhaps learning from previous mistakes, Google says it has designed the product  quot;from the ground up to respect user privacy.",Business,Sci/Tech,Sci/Tech,Both wrong,Business -> Sci/Tech,Business -> Sci/Tech
"USC, Miami Top BCS Standings, Not Okla. Southern California took the top spot Monday in the season's first Bowl Championship Series standings, and surprisingly Miami is ahead of Oklahoma in a close race for the second spot.    Oklahoma is No...",World,Sports,Sports,Both wrong,World -> Sports,World -> Sports
"IBM posts broad Q3 revenue growth NEW YORK - IBM Corp. posted quarterly results on Monday showing 9 percent revenue growth from last year and slight earnings growth, despite a \$320 million charge it took during the quarter to settle some claims in a lawsuit over its pension plan.",Sci/Tech,Business,Business,Both wrong,Sci/Tech -> Business,Sci/Tech -> Business
Regulators Approve Artificial Heart The Food and Drug Administration approved the use of an artificial heart made by SynCardia Systems as a temporary device for people awaiting transplants.,Sci/Tech,Business,Business,Both wrong,Sci/Tech -> Business,Sci/Tech -> Business
"Glazer stake in Man Utd nears 30 US tycoon Malcolm Glazer lifts his stake in Manchester Utd to 28.11, one day after spending 17m on  further share buys.",World,Sports,Sports,Both wrong,World -> Sports,World -> Sports
"Greenspan: Debt, home prices not dangerous The record level of debt carried by American households and soaring home prices do not appear to represent serious threats to the US economy, Federal Reserve Chairman Alan Greenspan said Tuesday.",Sci/Tech,Business,Business,Both wrong,Sci/Tech -> Business,Sci/Tech -> Business
Web-based kidney match raises ethics questions A Colorado man who placed a  quot;transplant wanted quot; ad on a Massachusetts-based Internet site is expected today to receive a kidney donated by a total stranger who simply wanted to do  quot;something big. quot; The transaction marks the first time an organ transplant has been brokered by a commercial web company.,Business,Sci/Tech,Sci/Tech,Both wrong,Business -> Sci/Tech,Business -> Sci/Tech
"Motorola Quarterly Earnings Rise Motorola Inc., the world's No. 2 maker of cell phones, on Tuesday said its quarterly profit\more than tripled, as sales rose 26 percent, driven in part by a host of new handset models and cost controls.",Sci/Tech,Business,Business,Both wrong,Sci/Tech -> Business,Sci/Tech -> Business
"Giga counters They #39;re bold, brash and break most rules of business -- so why are the Google guys multi-billionaires? GOOGLE Inc had plenty to celebrate at its recent annual summer picnic -- its debut as a public company ",Sci/Tech,Business,Business,Both wrong,Sci/Tech -> Business,Sci/Tech -> Business
"America #39;s curse There is an all but unanswerable case for asserting that the biggest story out of the United States this week has nothing to do with the presidential election, has no connection with the flu vaccine shortage and that it does not involve a gay bishop either ",Sports,Business,World,Both wrong,Sports -> Business,Sports -> World
Erdogan Believes European Council #39;s Decision Will Be A Milestone PARIS - Turkish PM Recep Tayyip Erdogan expressed belief on Thursday that the decision that the European Council would make on December 17th (on whether and when to open negotiations with Turkey) would be a milestone for not only Turkey-(EU) relations ,Business,World,World,Both wrong,Business -> World,Business -> World
"City Series-ly wounded With the Yanks out of the World Series, the city #39;s economy loses out on at least \$40 million, according to studies by the controller #39;s office and other city agencies.",Sports,Business,Business,Both wrong,Sports -> Business,Sports -> Business
"Avis blames IT for multimillion-dollar loss The car rental company takes a major hit because of problems with IT, including high costs associated with an ERP project.",Sci/Tech,Business,Business,Both wrong,Sci/Tech -> Business,Sci/Tech -> Business
"Amazon.com net sales jump 29; Google reports \$52M in net income OCTOBER 22, 2004 (IDG NEWS SERVICE) - Amazon.com Inc. fell a penny short of analysts #39; per-share earnings expectations, while reporting net sales of \$1.",Sci/Tech,Business,Business,Both wrong,Sci/Tech -> Business,Sci/Tech -> Business
"Google #39;s New PC Search Tool Poses Risks NEW YORK Oct. 18, 2004 - People who use public or workplace computers for e-mail, instant messaging and Web searching have a new privacy risk to worry about: Google #39;s free new tool that indexes a PC #39;s contents for quickly locating data.",Business,Sci/Tech,Sci/Tech,Both wrong,Business -> Sci/Tech,Business -> Sci/Tech
"Revolving Door  &lt;em&gt; IN&lt;/em&gt;&lt;br&gt;   Aylwin B. Lewis,  president of Yum Brands, as chief executive of Kmart.",World,Business,Business,Both wrong,World -> Business,World -> Business
"Approval Expected for Big Cellphone Deal Federal regulators will formally approve Cingular Wireless #39;s \$41 billion purchase of AT amp;T Wireless today, company officials briefed on the matter said over the weekend.",Sci/Tech,Business,Business,Both wrong,Sci/Tech -> Business,Sci/Tech -> Business
"Regulators Let Cingular Buy AT amp;T Wireless The \$41 billion merger between Cingular Wireless LLC and AT amp;T Wireless Services Inc. won approval from the Federal Communications Commission yesterday, according to federal sources close to ",Sci/Tech,Business,Business,Both wrong,Sci/Tech -> Business,Sci/Tech -> Business
Hynix's 3Q Profit More Than Triples (AP) AP - South Korea's Hynix Semiconductor Inc. said Monday its third-quarter net profit more than tripled from same period last year thanks to steady global prices for memory chips.,World,Sci/Tech,Sci/Tech,Both wrong,World -> Sci/Tech,World -> Sci/Tech
"Spyware opponents win another battle The Federal Trade Commission won an important victory last week in its fight to protect consumers from spyware, the software that tracks unsuspecting Web surfers, bombards them with advertisements and sometimes even steal login information and passwords.",Business,Sci/Tech,Sci/Tech,Both wrong,Business -> Sci/Tech,Business -> Sci/Tech
"Miss Peru takes Miss World crown Twenty-year-old Miss Peru has been crowned Miss World in a southern Chinese resort town, as China looks to become the regular host of an event that would have once been deemed heretical by its Communist leaders.",Sports,World,World,Both wrong,Sports -> World,Sports -> World
"Lockheed Profit Jumps on IT, Jet Demand &lt;p&gt;\&lt;/p&gt;&lt;p&gt; NEW YORK (Reuters) - No. 1 U.S. defense contractor Lockheed\Martin Corp. &lt;LMT.N&gt; reported a 41 percent rise in quarterly\profit on Tuesday, beating Wall Street forecasts, as demand\soared for its combat aircraft and information technology\services.&lt;/p&gt;",Sci/Tech,Business,Business,Both wrong,Sci/Tech -> Business,Sci/Tech -> Business
"EU Head Office Trims 2005 Growth Forecast (AP) AP - The European Union's head office issued a bleak economic report Tuesday, warning that the sharp rise in oil prices will ""take its toll"" on economic growth next year while the euro's renewed climb could threaten crucial exports.",World,Business,Business,Both wrong,World -> Business,World -> Business
"Microsoft Readies Next Business IM Server A little over a year after introducing the first version of Office Live Communications Server, Microsoft says it plans to release the next version of its enterprise instant messaging software, in December.",Business,Sci/Tech,Sci/Tech,Both wrong,Business -> Sci/Tech,Business -> Sci/Tech
"FaceTime, IMlogic Back Live Communications Server 2005 Hard on the heels of Microsoft announcing that it #39;s taken Live Communications Server 2005 gold, instant messaging management software vendors IMlogic and FaceTime on Tuesday both touted their support for the communication product.",Business,Sci/Tech,Sci/Tech,Both wrong,Business -> Sci/Tech,Business -> Sci/Tech
"Cingular Closes  #36;41 Bln ATT Wireless Deal (Reuters) Reuters - Cingular Wireless on Tuesday closed\its  #36;41 billion cash purchase of AT T Wireless Services Inc.\, creating the biggest U.S. mobile service with more\than 46 million customers.",Business,Sci/Tech,Sci/Tech,Both wrong,Business -> Sci/Tech,Business -> Sci/Tech
"Black Market in British Treasure Sold on EBay (Reuters) Reuters - Pieces of Britain's past, including a\second-century silver ring and a 500-year-old Tudor trade\weight, are among artifacts being peddled daily on the Internet\to the alarm of experts at the British Museum.",World,Sci/Tech,Sci/Tech,Both wrong,World -> Sci/Tech,World -> Sci/Tech
"Report finds handheld device market in continued decline The worldwide market for handheld devices saw its third successive quarter of year-over-year decline in the third quarter of 2004, according to a new report released by IDC.",Business,Sci/Tech,Sci/Tech,Both wrong,Business -> Sci/Tech,Business -> Sci/Tech
Will Tellabs Push Its Luck? Perhaps the optical network supplier should call off its merger with AFC.,Business,Sci/Tech,Sci/Tech,Both wrong,Business -> Sci/Tech,Business -> Sci/Tech
"Yahoo Debuts Mobile Search SAN FRANCISCO -- Yahoo (Quote, Chart) expanded its search empire to the mobile arena with the launch of some additional services. The company was one of the original content providers for mobile devices running ",Business,Sci/Tech,Sci/Tech,Both wrong,Business -> Sci/Tech,Business -> Sci/Tech
"Lexmark Loss Good for Consumers Lexmark's loss in court on Tuesday may mean that consumer electronics companies won't try to use the Digital Millenium Copyright Act as an all-purpose competition shield anymore, consumer advocates say. By Katie Dean.",Business,Sci/Tech,Sci/Tech,Both wrong,Business -> Sci/Tech,Business -> Sci/Tech
"Stability Control Systems Can Save Lives (AP) AP - Stability control systems could save up to 7,000 lives each year if they were standard equipment on all vehicles, according to a study by the insurance industry.",World,Sci/Tech,Sci/Tech,Both wrong,World -> Sci/Tech,World -> Sci/Tech
AOL Files Lawsuit Against IM  #39;Spim #39; America Online Inc. said Thursday it had filed a federal lawsuit accusing numerous unnamed defendants of violating federal and state laws by sending bulk messages known as  quot;spim quot; to instant message accounts and Internet chat rooms.,Business,Sci/Tech,Sci/Tech,Both wrong,Business -> Sci/Tech,Business -> Sci/Tech
"AOL, E-Mail Companies Sue Spammers The nation #39;s largest e-mail providers today filed a new round of lawsuits against Internet spammers allegedly responsible for shoveling millions of junk e-mail messages into computer users #39; in-boxes and their instant messaging screens.",Business,Sci/Tech,Sci/Tech,Both wrong,Business -> Sci/Tech,Business -> Sci/Tech
"Gateway Reports Smaller Quarterly Loss Gateway Inc. reported a narrowed net loss in the first quarter as it continues to restructure its operations and integrate its acquisition of eMachines. Still, the personal computer and electronics company posted a tiny operating profit -- its first in nearly three years.",Sci/Tech,Business,Business,Both wrong,Sci/Tech -> Business,Sci/Tech -> Business
"Blame player, not game It was like nothing youd ever exercised your thumbs to before. You could do whatever you wanted, whenever you wanted. The game seemed endless.",Sci/Tech,Sports,Sports,Both wrong,Sci/Tech -> Sports,Sci/Tech -> Sports
"Sign off, then sign in  G. Michael Caggiano Jr. lies awake at night thinking about bank signs. He ponders them during breakfast, while brushing his teeth, and  quot;constantly quot; during the day, he says.",Business,Sports,Sports,Both wrong,Business -> Sports,Business -> Sports
"EU Clears Flextronics Purchase of Units (AP) AP - European Union regulators Friday cleared Singapore's Flextronics International Ltd., the world's largest contract electronics manufacturer, to acquire factories from Canada's Nortel Networks Corp.",World,Business,Sci/Tech,Both wrong,World -> Business,World -> Sci/Tech
"Times to Scrap Broadsheet Edition The Times is to scrap its broadsheet edition and go tabloid from Monday, it was confirmed today. The decision was made after a trial run of the compact edition proved a success, said editor Robert Thomson.",Sports,Sci/Tech,Sci/Tech,Both wrong,Sports -> Sci/Tech,Sports -> Sci/Tech
AOL's Viral Marketing America Online will now provide gratis antivirus protection to its subscribers.,Business,Sci/Tech,Sci/Tech,Both wrong,Business -> Sci/Tech,Business -> Sci/Tech
"THE UNFOLDING UNIFORM Pakistan is inherently unstable. Dealing with them is like playing with matches in a forest. - Larry Pressler. That statement from Larry Pressler, made during his recent visit to India, coincided with ",World,Sports,Sports,Both wrong,World -> Sports,World -> Sports
FleetCenter to be reunion arena It has all the gossipy intrigue and social awkwardness of seating the still-respected ex-wife and the sexy new girlfriend at the same table for a family wedding.,Sports,World,Sci/Tech,Both wrong,Sports -> World,Sports -> Sci/Tech
"Gateway Can Party Like It #39;s 1999 Those were heady days, they were, back in 1999. The bull market was still roaring. We hadn #39;t yet heard of hanging or dimpled chads.",Sci/Tech,Business,Sports,Both wrong,Sci/Tech -> Business,Sci/Tech -> Sports
"SIA: Chip sales to hit record, flatten Worldwide semiconductor sales will hit an all-time high in 2004 but stay relatively flat in 2005 before climbing again over the next two years, according to the Semiconductor Industry Association.",Business,Sci/Tech,Sci/Tech,Both wrong,Business -> Sci/Tech,Business -> Sci/Tech
"Quick end to US election crucial US President George W. Bush is on the verge of a re-election victory, but Democratic challenger John Kerry is not conceding defeat, at least not now.",Business,World,World,Both wrong,Business -> World,Business -> World
"Another homicide in Holland  It is a sad day.      In what seems to be another politically inspired homicide in Holland, Dutch filmmaker, and controversial columnist Theo van Gogh was brutally murdered in the streets of Amsterdam this morning.",Sci/Tech,World,World,Both wrong,Sci/Tech -> World,Sci/Tech -> World
"Argentina Basketball Coach Magnano Quits Ruben Magnano, who coached Argentina to the Olympic basketball gold medal in Athens, resigned Thursday to accept a coaching job in Italy.",World,Sports,Sports,Both wrong,World -> Sports,World -> Sports
"Product Previews palmOneUpgrades Treo With Faster Chip, Better Display\With more than 600,000 units shipped, the Treo 600 is one of the big smartphone success stories. Last week, palmOne introduced the follow-on Treo 650 with a higher resolution 320-by-320-pixel TFT screen, which the company claims increases the visible area of the display and makes pictures and documents much clearer. The 650 also carries a removable battery; 32MB of flash memory, and a faster 312MHz, Intel XScale processor. Improved multimedia features include a built-in MP3 player, a digital camera with improved low-light capabilities, as well as video capture and playback functionality. Products are expected to ship by years end from some carriers who will add their own services, and will be priced at about \$499.\ Treo 650, palmOne",Business,Sci/Tech,Sci/Tech,Both wrong,Business -> Sci/Tech,Business -> Sci/Tech
"Serial HIV Assault Verdict Expected Mon. (AP) AP - A verdict will be announced Monday in the trial of a man charged with intentionally exposing 17 women to HIV, a county judge said.",Sci/Tech,World,World,Both wrong,Sci/Tech -> World,Sci/Tech -> World
"Contradiction in Terms : How to make beer It's been around for thousands of years. It has been worshiped, reviled, banned, and made the cornerstone of economies. It has helped us celebrate, weep, relax, and get laid. And now we're going to make some. A pint, a glass, an ale, a lager, a beer.",Sci/Tech,World,Business,Both wrong,Sci/Tech -> World,Sci/Tech -> Business
"Ontario gets harsh with school dropouts HUNTSVILLE, ONT. - The Ontario government plans to introduce legislation that will require students to stay in school until they reach the age of 18, said the province?",Business,World,World,Both wrong,Business -> World,Business -> World
"Travelocity Says Speed Is the Ticket For Growth Sam Gilliand, the chief executive of Travelocity, talks about the online travel industry, the Cendant-Orbitz merger and the woes of the airline industry.",Sci/Tech,Business,Business,Both wrong,Sci/Tech -> Business,Sci/Tech -> Business
"Colombia Accuses Cos. of Illegal Imports The Colombian government has filed a lawsuit accusing Pernod Ricard SA, Diageo PLC and Seagram Export Sales Co. of illegally importing spirits via Colombian companies that launder drug money.",World,Business,Business,Both wrong,World -> Business,World -> Business
Australia in grip of water crisis There is a warning that some of Australia's major cities could run out of drinking water.,Sci/Tech,World,World,Both wrong,Sci/Tech -> World,Sci/Tech -> World
"Cocoa prices down but Ivorian exports still blocked World cocoa prices were down on Tuesday but off the day #39;s lows as exports remained on hold after mob violence and military clashes in Ivory Coast, the key global supplier, traders said.",World,Business,Business,Both wrong,World -> Business,World -> Business
"The Bag of Aeolus  quot;Aeolus was keeper of the winds. He gave a bag of evil winds to Odysseus, instructing him to keep it closed while a good breeze wafted him home.",World,Sports,Sports,Both wrong,World -> Sports,World -> Sports
Fusion reactor decision must wait Six nations planning to build the world's biggest nuclear fusion reactor fail to agree where to site the facility.,Sci/Tech,World,World,Both wrong,Sci/Tech -> World,Sci/Tech -> World
"Vodafone begins 3G service Vodafone launches its third-generation services for mobile phones, offering video calls, music downloads and games.",Business,Sci/Tech,Sci/Tech,Both wrong,Business -> Sci/Tech,Business -> Sci/Tech
"(B)old new frontiers Northrop Grumman Corp. and Boeing Co. yesterday announced plans to team up to design a vehicle to take astronauts back to the moon and even beyond, but they #39;ve got to make one stop first ",Business,Sci/Tech,Sci/Tech,Both wrong,Business -> Sci/Tech,Business -> Sci/Tech
Halo 2 scores record sales of \$125 million in first 24 hours Halo 2 broke entertainment retail records in its first 24 hours. Microsoft Game Studios said that the video game sold through 2.4 million stores in the US and Canada raking in \$125 million in sales.,Business,Sci/Tech,Sci/Tech,Both wrong,Business -> Sci/Tech,Business -> Sci/Tech
"Prized Fossil Just a Rock? With positive and negative results, it remains to be seen what type of Fossil this company really is.",Business,Sci/Tech,Sci/Tech,Both wrong,Business -> Sci/Tech,Business -> Sci/Tech
Hit TV series 24 goes from small screen to smaller screen (AFP) AFP - The hit US television show  quot;24 quot; is going from the small screen to the smaller after 20th Century Fox and Vodaphone struck a groundbreaking deal to distribute the drama on mobile telephones.,Sci/Tech,World,World,Both wrong,Sci/Tech -> World,Sci/Tech -> World
"China's inflation rate slows sharply but problems remain (AFP) AFP - China's inflation rate eased sharply in October as government efforts to cool the economy began to really bite, with food prices, one of the main culprits, showing some signs of slowing, official data showed.",World,Business,Business,Both wrong,World -> Business,World -> Business
"Telephone Tag (Forbes.com) Forbes.com - ARRIS GROUP (5, ARRS) saw its market cap unjustifiably halved recently when Comcast, a huge customer (24 of Arris' sales), hinted it might buy next-generation technology from Cisco Systems. Arris supplies the technical guts that cable companies use to provide phone service. (For the reverse phenomenon, see story on p. 162.)",Business,Sci/Tech,Sci/Tech,Both wrong,Business -> Sci/Tech,Business -> Sci/Tech
Donors seek clarity on PA finances Donors to the Palestinians are asking  whether the change of leadership can let more light into Palestinian finances.,Business,World,World,Both wrong,Business -> World,Business -> World
"U.S. to Allow Some Telemarketing 'Robo Calls'  WASHINGTON (Reuters) - Telemarketers will be able to use  prerecorded ""robo calls"" to stay in touch with established  customers starting next week -- at least for the short term,  U.S. regulators said Friday.",Sci/Tech,Business,Business,Both wrong,Sci/Tech -> Business,Sci/Tech -> Business
Court ruling has fat cats purring THE future of horseracing in Britain was thrown into confusion this week as a result of a judgment by the European Court of Justice.,Sci/Tech,World,Sports,Both wrong,Sci/Tech -> World,Sci/Tech -> Sports
Will Hutton There were two stories last week that will have world-shaping implications. The first was in a Paris hospital and a compound in Ramallah.,Business,World,World,Both wrong,Business -> World,Business -> World
Safety Group Closely Echoes Rail Industry Documents show that the nation's most influential rail-safety group is tightly bound to the railroad industry.,World,Business,Business,Both wrong,World -> Business,World -> Business
"GAME UNDER FIRE Attacking police officers, racial slurs, bloody beatings of innocent bystanders ... is it really just a game? In four and a half minutes, 14-year-old Ryan Mason ran over a police officer, stole his gun and shot and killed three innocent bystanders.",Sci/Tech,Sports,Sports,Both wrong,Sci/Tech -> Sports,Sci/Tech -> Sports
"Where have all the people gone? While media and political attention is on the threat of outsourcing, the reality is that outsourcing is a sideshow in a much larger event.",Business,Sci/Tech,Sci/Tech,Both wrong,Business -> Sci/Tech,Business -> Sci/Tech
Boston archbishop reveals anguish of closings BOSTON Boston #39;s Archbishop is telling catholics that the church #39;s financial footing is  quot;much worse than people realize.,Sports,Business,Business,Both wrong,Sports -> Business,Sports -> Business
"Dow Jones Agrees to Buy MarketWatch in \$519 Million Deal Dow Jones   Company, the publisher of The Wall Street Journal, has agreed to buy MarketWatch, the parent company of the financial news Web site CBS MarketWatch, for approximately \$519 million, the companies said today.",World,Business,Business,Both wrong,World -> Business,World -> Business
